{
  "dataset_id": "pfbench_demo",
  "scenario_id": "scn_case14_648b44b17a15",
  "source_case": "case14",
  "split": "dev",
  "grid_reference": {
    "case_name": "case14",
    "source_library": "matpower",
    "source_url": "https://raw.githubusercontent.com/MATPOWER/matpower/master/data/case14.m",
    "matpower_case_format_version": "2",
    "base_mva": 100.0,
    "counts": {
      "num_buses": 14,
      "num_generators": 5,
      "num_branches": 20
    },
    "bus_partition_counts": {
      "num_slack_buses": 1,
      "num_pv_buses": 4,
      "num_pq_buses": 9
    },
    "data_digest": "d33179a25fb33115"
  },
  "base_grid_snapshot": {
    "bus_partition": {
      "slack_bus_ids": [
        1
      ],
      "pv_bus_ids": [
        2,
        3,
        6,
        8
      ],
      "pq_bus_ids": [
        4,
        5,
        7,
        9,
        10,
        11,
        12,
        13,
        14
      ]
    },
    "buses": [
      {
        "bus_id": 1,
        "bus_name": "Bus 1 HV",
        "type_code": 3,
        "type_label": "Slack",
        "pd_mw": 0.0,
        "qd_mvar": 0.0,
        "gs_mw": 0.0,
        "bs_mvar": 0.0,
        "area": 1,
        "vm_init_pu": 1.06,
        "va_init_deg": 0.0,
        "base_kv": 0.0,
        "zone": 1,
        "vmax_pu": 1.06,
        "vmin_pu": 0.94
      },
      {
        "bus_id": 2,
        "bus_name": "Bus 2 HV",
        "type_code": 2,
        "type_label": "PV",
        "pd_mw": 21.7,
        "qd_mvar": 12.7,
        "gs_mw": 0.0,
        "bs_mvar": 0.0,
        "area": 1,
        "vm_init_pu": 1.045,
        "va_init_deg": -4.98,
        "base_kv": 0.0,
        "zone": 1,
        "vmax_pu": 1.06,
        "vmin_pu": 0.94
      },
      {
        "bus_id": 3,
        "bus_name": "Bus 3 HV",
        "type_code": 2,
        "type_label": "PV",
        "pd_mw": 94.2,
        "qd_mvar": 19.0,
        "gs_mw": 0.0,
        "bs_mvar": 0.0,
        "area": 1,
        "vm_init_pu": 1.01,
        "va_init_deg": -12.72,
        "base_kv": 0.0,
        "zone": 1,
        "vmax_pu": 1.06,
        "vmin_pu": 0.94
      },
      {
        "bus_id": 4,
        "bus_name": "Bus 4 HV",
        "type_code": 1,
        "type_label": "PQ",
        "pd_mw": 47.8,
        "qd_mvar": -3.9,
        "gs_mw": 0.0,
        "bs_mvar": 0.0,
        "area": 1,
        "vm_init_pu": 1.019,
        "va_init_deg": -10.33,
        "base_kv": 0.0,
        "zone": 1,
        "vmax_pu": 1.06,
        "vmin_pu": 0.94
      },
      {
        "bus_id": 5,
        "bus_name": "Bus 5 HV",
        "type_code": 1,
        "type_label": "PQ",
        "pd_mw": 7.6,
        "qd_mvar": 1.6,
        "gs_mw": 0.0,
        "bs_mvar": 0.0,
        "area": 1,
        "vm_init_pu": 1.02,
        "va_init_deg": -8.78,
        "base_kv": 0.0,
        "zone": 1,
        "vmax_pu": 1.06,
        "vmin_pu": 0.94
      },
      {
        "bus_id": 6,
        "bus_name": "Bus 6 LV",
        "type_code": 2,
        "type_label": "PV",
        "pd_mw": 11.2,
        "qd_mvar": 7.5,
        "gs_mw": 0.0,
        "bs_mvar": 0.0,
        "area": 1,
        "vm_init_pu": 1.07,
        "va_init_deg": -14.22,
        "base_kv": 0.0,
        "zone": 1,
        "vmax_pu": 1.06,
        "vmin_pu": 0.94
      },
      {
        "bus_id": 7,
        "bus_name": "Bus 7 ZV",
        "type_code": 1,
        "type_label": "PQ",
        "pd_mw": 0.0,
        "qd_mvar": 0.0,
        "gs_mw": 0.0,
        "bs_mvar": 0.0,
        "area": 1,
        "vm_init_pu": 1.062,
        "va_init_deg": -13.37,
        "base_kv": 0.0,
        "zone": 1,
        "vmax_pu": 1.06,
        "vmin_pu": 0.94
      },
      {
        "bus_id": 8,
        "bus_name": "Bus 8 TV",
        "type_code": 2,
        "type_label": "PV",
        "pd_mw": 0.0,
        "qd_mvar": 0.0,
        "gs_mw": 0.0,
        "bs_mvar": 0.0,
        "area": 1,
        "vm_init_pu": 1.09,
        "va_init_deg": -13.36,
        "base_kv": 0.0,
        "zone": 1,
        "vmax_pu": 1.06,
        "vmin_pu": 0.94
      },
      {
        "bus_id": 9,
        "bus_name": "Bus 9 LV",
        "type_code": 1,
        "type_label": "PQ",
        "pd_mw": 29.5,
        "qd_mvar": 16.6,
        "gs_mw": 0.0,
        "bs_mvar": 19.0,
        "area": 1,
        "vm_init_pu": 1.056,
        "va_init_deg": -14.94,
        "base_kv": 0.0,
        "zone": 1,
        "vmax_pu": 1.06,
        "vmin_pu": 0.94
      },
      {
        "bus_id": 10,
        "bus_name": "Bus 10 LV",
        "type_code": 1,
        "type_label": "PQ",
        "pd_mw": 9.0,
        "qd_mvar": 5.8,
        "gs_mw": 0.0,
        "bs_mvar": 0.0,
        "area": 1,
        "vm_init_pu": 1.051,
        "va_init_deg": -15.1,
        "base_kv": 0.0,
        "zone": 1,
        "vmax_pu": 1.06,
        "vmin_pu": 0.94
      },
      {
        "bus_id": 11,
        "bus_name": "Bus 11 LV",
        "type_code": 1,
        "type_label": "PQ",
        "pd_mw": 3.5,
        "qd_mvar": 1.8,
        "gs_mw": 0.0,
        "bs_mvar": 0.0,
        "area": 1,
        "vm_init_pu": 1.057,
        "va_init_deg": -14.79,
        "base_kv": 0.0,
        "zone": 1,
        "vmax_pu": 1.06,
        "vmin_pu": 0.94
      },
      {
        "bus_id": 12,
        "bus_name": "Bus 12 LV",
        "type_code": 1,
        "type_label": "PQ",
        "pd_mw": 6.1,
        "qd_mvar": 1.6,
        "gs_mw": 0.0,
        "bs_mvar": 0.0,
        "area": 1,
        "vm_init_pu": 1.055,
        "va_init_deg": -15.07,
        "base_kv": 0.0,
        "zone": 1,
        "vmax_pu": 1.06,
        "vmin_pu": 0.94
      },
      {
        "bus_id": 13,
        "bus_name": "Bus 13 LV",
        "type_code": 1,
        "type_label": "PQ",
        "pd_mw": 13.5,
        "qd_mvar": 5.8,
        "gs_mw": 0.0,
        "bs_mvar": 0.0,
        "area": 1,
        "vm_init_pu": 1.05,
        "va_init_deg": -15.16,
        "base_kv": 0.0,
        "zone": 1,
        "vmax_pu": 1.06,
        "vmin_pu": 0.94
      },
      {
        "bus_id": 14,
        "bus_name": "Bus 14 LV",
        "type_code": 1,
        "type_label": "PQ",
        "pd_mw": 14.9,
        "qd_mvar": 5.0,
        "gs_mw": 0.0,
        "bs_mvar": 0.0,
        "area": 1,
        "vm_init_pu": 1.036,
        "va_init_deg": -16.04,
        "base_kv": 0.0,
        "zone": 1,
        "vmax_pu": 1.06,
        "vmin_pu": 0.94
      }
    ],
    "generators": [
      {
        "gen_id": 1,
        "bus_id": 1,
        "pg_mw": 232.4,
        "qg_mvar": -16.9,
        "qmax_mvar": 10.0,
        "qmin_mvar": 0.0,
        "vg_pu": 1.06,
        "m_base_mva": 100.0,
        "status": 1,
        "pmax_mw": 332.4,
        "pmin_mw": 0.0,
        "is_slack_bus": true,
        "is_pv_bus": false
      },
      {
        "gen_id": 2,
        "bus_id": 2,
        "pg_mw": 40.0,
        "qg_mvar": 42.4,
        "qmax_mvar": 50.0,
        "qmin_mvar": -40.0,
        "vg_pu": 1.045,
        "m_base_mva": 100.0,
        "status": 1,
        "pmax_mw": 140.0,
        "pmin_mw": 0.0,
        "is_slack_bus": false,
        "is_pv_bus": true
      },
      {
        "gen_id": 3,
        "bus_id": 3,
        "pg_mw": 0.0,
        "qg_mvar": 23.4,
        "qmax_mvar": 40.0,
        "qmin_mvar": 0.0,
        "vg_pu": 1.01,
        "m_base_mva": 100.0,
        "status": 1,
        "pmax_mw": 100.0,
        "pmin_mw": 0.0,
        "is_slack_bus": false,
        "is_pv_bus": true
      },
      {
        "gen_id": 4,
        "bus_id": 6,
        "pg_mw": 0.0,
        "qg_mvar": 12.2,
        "qmax_mvar": 24.0,
        "qmin_mvar": -6.0,
        "vg_pu": 1.07,
        "m_base_mva": 100.0,
        "status": 1,
        "pmax_mw": 100.0,
        "pmin_mw": 0.0,
        "is_slack_bus": false,
        "is_pv_bus": true
      },
      {
        "gen_id": 5,
        "bus_id": 8,
        "pg_mw": 0.0,
        "qg_mvar": 17.4,
        "qmax_mvar": 24.0,
        "qmin_mvar": -6.0,
        "vg_pu": 1.09,
        "m_base_mva": 100.0,
        "status": 1,
        "pmax_mw": 100.0,
        "pmin_mw": 0.0,
        "is_slack_bus": false,
        "is_pv_bus": true
      }
    ],
    "branches": [
      {
        "branch_id": 1,
        "from_bus": 1,
        "to_bus": 2,
        "r_pu": 0.01938,
        "x_pu": 0.05917,
        "b_pu": 0.0528,
        "rate_a_mva": 0.0,
        "rate_b_mva": 0.0,
        "rate_c_mva": 0.0,
        "tap_ratio": 1.0,
        "shift_deg": 0.0,
        "status": 1,
        "angmin_deg": -360.0,
        "angmax_deg": 360.0,
        "element_type": "line"
      },
      {
        "branch_id": 2,
        "from_bus": 1,
        "to_bus": 5,
        "r_pu": 0.05403,
        "x_pu": 0.22304,
        "b_pu": 0.0492,
        "rate_a_mva": 0.0,
        "rate_b_mva": 0.0,
        "rate_c_mva": 0.0,
        "tap_ratio": 1.0,
        "shift_deg": 0.0,
        "status": 1,
        "angmin_deg": -360.0,
        "angmax_deg": 360.0,
        "element_type": "line"
      },
      {
        "branch_id": 3,
        "from_bus": 2,
        "to_bus": 3,
        "r_pu": 0.04699,
        "x_pu": 0.19797,
        "b_pu": 0.0438,
        "rate_a_mva": 0.0,
        "rate_b_mva": 0.0,
        "rate_c_mva": 0.0,
        "tap_ratio": 1.0,
        "shift_deg": 0.0,
        "status": 1,
        "angmin_deg": -360.0,
        "angmax_deg": 360.0,
        "element_type": "line"
      },
      {
        "branch_id": 4,
        "from_bus": 2,
        "to_bus": 4,
        "r_pu": 0.05811,
        "x_pu": 0.17632,
        "b_pu": 0.034,
        "rate_a_mva": 0.0,
        "rate_b_mva": 0.0,
        "rate_c_mva": 0.0,
        "tap_ratio": 1.0,
        "shift_deg": 0.0,
        "status": 1,
        "angmin_deg": -360.0,
        "angmax_deg": 360.0,
        "element_type": "line"
      },
      {
        "branch_id": 5,
        "from_bus": 2,
        "to_bus": 5,
        "r_pu": 0.05695,
        "x_pu": 0.17388,
        "b_pu": 0.0346,
        "rate_a_mva": 0.0,
        "rate_b_mva": 0.0,
        "rate_c_mva": 0.0,
        "tap_ratio": 1.0,
        "shift_deg": 0.0,